name,contact_first_name,contact_last_name,contact_name,email,contact_email,fax,mailing_address_line_1,mailing_address_line_2,mailing_city,mailing_contact_first_name,mailing_contact_last_name,mailing_contact_name,mailing_country,mailing_county,mailing_postalcode,mailing_province,provider_name,primary_phone,secondary_phone,twitter,website,source,contact_occupation,dsgne_first_name,dsgne_last_name,admin_name,co_address_line_1,co_address_line_2,co_company,co_city,co_postalcode,co_province,ombudsman_phone,typeofcare,typeofcare2,low_high_rate,low_rate,high_rate,address_line_1,address_line_2,address_directions,city,municipality,region,province,state_id,postal_code,country,latitude,longitude,neighborhood,addr_valid
EL PASEO SENIOR CARE CENTER CORP,,,,,,,1390 NW 7 ST,,MIAMI,,,,,Miami-Dade,33125,FL,,(786) 655-0939,,,,,,,,,,,,,,,,,Adult Day Care Center,,,,1390 NW 7 ST,,,MIAMI,Miami-Dade,,FL,,33125,,25.779981,-80.2179383,East Little Havana,False
ELDER DAY STAY,,,,,,,2518 WEST TENNESSEE STREET,,TALLAHASSEE,,,,,Leon,32304,FL,,(850) 921-5554,,,,,,,,,,,,,,,,,Adult Day Care Center,,,,1660- 11 NORTH MONROE St,,,TALLAHASSEE,Leon,,FL,,32303,,30.4617181,-84.2815542,Levy Park,True
ELDER'S PLACE ADULT DAY CARE  LLC,,,,,,,12318 QUAIL ROOST DR,,MIAMI,,,,,Miami-Dade,33177,FL,,(305) 878-4773,,,,,,,,,,,,,,,,,Adult Day Care Center,,,,12318 QUAIL ROOST DR,,,MIAMI,Miami-Dade,,FL,,33177,,25.5822814,-80.3915375,,False
ELITE ADULT DAY CARE CENTER INC,,,,,,,50 LINDSAY CT # 101,,HIALEAH,,,,,Miami-Dade,33010-5224,FL,,(305) 557-8007,,,,,,,,,,,,,,,,,Adult Day Care Center,,,,2050 W 56TH ST,,,HIALEAH,Miami-Dade,,FL,,33016-2601,,25.8729224,-80.3244407,,False
EMERALD ADULT RECREATIONAL CENTER  INC,,,,,,,14228-30 SW 8ST UNIT 23,,MIAMI,,,,,Miami-Dade,33184,FL,,(305) 220-4720,,,,,,,,,,,,,,,,,Adult Day Care Center,,,,14228-30 SW 8ST,UNIT 23,,MIAMI,Miami-Dade,,FL,,33184,,25.7662048,-80.1939885,Brickell,False
ENDLESS YEARS ADULT CARE CENTER CORP,,,,,,,8004 NW 154TH ST STE 108,,MIAMI LAKES,,,,,Miami-Dade,33016,FL,,(786) 295-7036,,,Marlene713@bellsouth.net,,,,,,,,,,,,,,Adult Day Care Center,,,,5931 NW 173RD DR,UNIT 11,,MIAMI,Miami-Dade,,FL,,33015,,25.9311445,-80.2989498,,False
ESENCIA DE LA VIDA ADULT DAY CARE  INC.,,,,,,,4750 W FLAGLER ST,,MIAMI,,,,,Miami-Dade,33134,FL,,(786) 488-3503,,,,,,,,,,,,,,,,,Adult Day Care Center,,,,4750 W FLAGLER ST,,,MIAMI,Miami-Dade,,FL,,33134,,25.77113,-80.2726703,Flagami,False
EVERGREEN ADULT DAY CARE CENTER,,,,,,,13945 EVERGREEN AVE,,CLEARWATER,,,,,Pinellas,33762,FL,,(727) 573-9444,,,neighborly.org,,,,,,,,,,,,,,Adult Day Care Center,,,,13945 EVERGREEN AVE,,,CLEARWATER,Pinellas,,FL,,33762,,27.899473,-82.679371,,False
EVERYDAY SUNSHINE DAYCARE CENTER INC,,,,,,,3750 W 16 AVE  STE 202,,HIALEAH,,,,,Miami-Dade,33012,FL,,(786) 597-3698,,,,,,,,,,,,,,,,,Adult Day Care Center,,,,3750 W 16 AVE,STE 202,,HIALEAH,Miami-Dade,,FL,,33012,,25.8557027,-80.3150867,,False
FLORIDA PACE CENTERS INC,,,,,,,5200 NE 2ND AVE,,MIAMI,,,,,Miami-Dade,33137,FL,,(305) 751-8626,,,,,,,,,,,,,,,,,Adult Day Care Center,,,,2814 CORPORATE WAY,,,MIRAMAR,Broward,,FL,,33025,,25.9833849,-80.28608799999999,,False
FLORIDA PACE CENTERS  INC,,,,,,,5200 NE 2ND AVENUE,,MIAMI,,,,,Miami-Dade,33137,FL,,(305) 751-8626,,,,,,,,,,,,,,,,,Adult Day Care Center,,,,5200 NE 2ND Ave,,,MIAMI,Miami-Dade,,FL,,33137,,25.82286779999999,-80.1924317,Little Haiti,True
FLORIDA PACE CENTERS  INC,,,,,,,5200 NE 2ND AVE,,MIAMI,,,,,Miami-Dade,33137-2706,FL,,(786) 347-2040,,,,,,,,,,,,,,,,,Adult Day Care Center,,,,60 E 3RD ST,,,HIALEAH,Miami-Dade,,FL,,33010-4973,,25.8244504,-80.2798842,,False
FLORIDA PACE CENTERS  INC,,,,,,,2700 SW 97TH AVE,,MIAMI,,,,,Miami-Dade,33165,FL,,(305) 704-7815,,,www.pace4you.org,,,,,,,,,,,,,,Adult Day Care Center,,,,2700 SW 97TH AVE,,,MIAMI,Miami-Dade,,FL,,33165,,25.7447735,-80.35199039999999,,False
GARDEN ADULT DAY CARE LLC,,,,,,,10550 NW 77TH CT STE 315,,HIALEAH GARDENS,,,,,Miami-Dade,33016,FL,,(305) 992-5327,,,,,,,,,,,,,,,,,Adult Day Care Center,,,,10550 NW 77TH CT,STE 315,,HIALEAH GARDENS,Miami-Dade,,FL,,33016,,25.8691604,-80.32511679999999,,False
GARDEN OF EDEN 2015 CORP (THE),,,,,,,681 E 9TH ST,,HIALEAH,,,,,Miami-Dade,33010,FL,,(347) 601-0092,,,,,,,,,,,,,,,,,Adult Day Care Center,,,,681 E 9TH ST,,,HIALEAH,Miami-Dade,,FL,,33010,,25.8316067,-80.2674503,,False
GENOMA THERAPEUTIC ADULT DAY CARE CENTER  INC,,,,,,,4621 LAKE WORTH RD,,GREENACRES,,,,,Palm Beach,33463-3451,FL,,(561) 557-4719,,,www.genomaadcc.com,,,,,,,,,,,,,,Adult Day Care Center,,,,4621 LAKE WORTH RD,,,GREENACRES,Palm Beach,,FL,,33463-3451,,26.6185937,-80.1158505,,False
GENTLE CARING HANDS ADULT DAY CARE,,,,,,,1537 LONGFELLOW AVE,,BRONX,,,,,,10460-5431,NY,,(646) 303-7576,,,gchadultdaycare.com,,,,,,,,,,,,,,Adult Day Care Center,,,,1893 SNAPPER DR,,,KISSIMMEE,Polk,,FL,,34759-4823,,28.0770716,-81.49954939999999,,False
GILD ADULT DAYCARE LLC,,,,,,,18901 SW 106 AVE STE A118-A120,,MIAMI,,,,,Miami-Dade,33157,FL,,(305) 224-5940,,,,,,,,,,,,,,,,,Adult Day Care Center,,,,18901 SW 106 AVE,STE A118-A120,,MIAMI,Miami-Dade,,FL,,33157,,25.59003689999999,-80.3618762,,False
GOLDEN AGE ADULT DAYCARE LLC,,,,,,,2039 N UNIVERSITY DR,,SUNRISE,,,,,Broward,33322,FL,,(954) 748-1866,,,goldenageadultdaycare.org,,,,,,,,,,,,,,Adult Day Care Center,,,,2039 N UNIVERSITY DR,,,SUNRISE,Broward,,FL,,33322,,26.151346,-80.25727619999999,,False
GOLDEN AGE DAY CENTER INC,,,,,,,30370 OLD DIXIE HWY,,HOMESTEAD,,,,,Miami-Dade,33030,FL,,(786) 252-7632,,,,,,,,,,,,,,,,,Adult Day Care Center,,,,30370 OLD DIXIE HWY,,,HOMESTEAD,Miami-Dade,,FL,,33030,,25.4854267,-80.4629291,,False
GOLDEN SMILE ADULT DAY CARE  LLC,,,,,,,1726 E HALLANDALE BEACH BLVD,,HALLANDALE BEACH,,,,,Broward,33009,FL,,(754) 703-5684,,,,,,,,,,,,,,,,,Adult Day Care Center,,,,1726 E HALLANDALE BEACH BLVD,,,HALLANDALE BEACH,Broward,,FL,,33009,,25.9856604,-80.1294411,,False
GOLDEN TIME ADULT DAY CARE,,,,,,,11980 SW 8TH STREET  STE. 15,,MIAMI,,,,,Miami-Dade,33184,FL,,(305) 552-6162,,,,,,,,,,,,,,,,,Adult Day Care Center,,,,11980 SW 8TH St,STE 15,,MIAMI,Miami-Dade,,FL,,33184,,25.7602337,-80.3901622,,True
GRANDA'S ADULT DAY CARE,,,,,,,16267 SW 88TH ST,,MIAMI,,,,,Miami-Dade,33196,FL,,(305) 386-8356,,,,,,,,,,,,,,,,,Adult Day Care Center,,,,16267 SW 88TH ST,,,MIAMI,Miami-Dade,,FL,,33196,,25.6840361,-80.458846,,False
GRANDPARENTS ADULT DAY CARE CORP,,,,,,,1131 NW 22ND AVE,,MIAMI,,,,,Miami-Dade,33125,FL,,(305) 302-7070,,,,,,,,,,,,,,,,,Adult Day Care Center,,,,1131 NW 22ND AVE,,,MIAMI,Miami-Dade,,FL,,33125,,25.7840153,-80.23117359999999,Little Havana,False
GRANDPARENTS CLUB ADULT DAY CARE  LLC,,,,,,,4729 NW 183 ST,,MIAMI,,,,,Miami-Dade,33055,FL,,(786) 916-5306,,,,,,,,,,,,,,,,,Adult Day Care Center,,,,4729 NW 183 ST,,,MIAMI,Miami-Dade,,FL,,33055,,25.9397452,-80.2786874,,False
GREENACRES ADULT DAYCARE LLC,,,,,,,6623 FOREST HILL BLVD,,GREENACRES,,,,,Palm Beach,33413,FL,,(941) 786-6786,,,www.greenacresadultdaycare.com,,,,,,,,,,,,,,Adult Day Care Center,,,,6623 FOREST HILL BLVD,,,GREENACRES,Palm Beach,,FL,,33413,,26.6526019,-80.14660409999999,,False
HAINES CITY MULTIPURPOSE SENIOR CENTER,,,,,,,PO BOX 9005,DRAWER HS-07,BARTOW,,,,,Polk,33831-9005,FL,,(863) 421-3369,,,,,,,,,,,,,,,,,Adult Day Care Center,,,,751 SCENIC Hwy,,,HAINES CITY,Polk,,FL,,33844,,28.0844992,-81.62499079999999,,True
HAPPY DAYS ADULT DAY CARE LLC,,,,,,,1409 SW 22ND STREET,,MIAMI,,,,,,33145,FL,,(305) 285-9070,,,,,,,,,,,,,,,,,Adult Day Care Center,,,,1409 SW 22ND St,,,MIAMI,Miami-Dade,,FL,,33145,,25.7511215,-80.2188845,Coral Way,True
HAPPY FACE ADULT DAY CARE LLC,,,,,,,5856 W FLAGLER ST,,MIAMI,,,,,Miami-Dade,33144,FL,,(305) 755-2980,,,,,,,,,,,,,,,,,Adult Day Care Center,,,,5856 W FLAGLER ST,,,MIAMI,Miami-Dade,,FL,,33144,,25.770508,-80.2909789,Flagami,False
HAPPY FAMILY ADULT DAY CARE  CORP,,,,,,,413 NE VAN LOON LN STE 110,,CAPE CORAL,,,,,Lee,33909,FL,,(239) 800-3803,,,,,,,,,,,,,,,,,Adult Day Care Center,,,,413 NE VAN LOON LN,STE 110,,CAPE CORAL,Lee,,FL,,33909,,26.6534283,-81.9661856,Hancock,False
HAPPY TIMES ADULT DAY CARE CENTER CORP,,,,,,,50 WEST 29TH STREET  SUITES A & B,,HIALEAH,,,,,Miami-Dade,33012,FL,,(305) 805-1040,,,,,,,,,,,,,,,,,Adult Day Care Center,,,,50 WEST 29TH STREET SUITES A & B,,,HIALEAH,Miami-Dade,,FL,,33012,,25.8481314,-80.2831841,,False
HARRIS HOUSE ADULT DAYCARE CENTER  INC,,,,,,,9857 GIBSON AVENUE,,JACKSONVILLE,,,,,Duval,32208,FL,,(904) 343-7411,,,www.harrishouseadultdaycare.com,,,,,,,,,,,,,,Adult Day Care Center,,,,9857 GIBSON Ave,,,JACKSONVILLE,Duval,,FL,,32208,,30.4150221,-81.71307589999999,Northside,True
HEYDAYS SENIOR DAY PROGRAM,,,,,,,210 N GROVE STREET,,MERRITT ISLAND,,,,,Brevard,32953,FL,,(321) 474-8289,,,,,,,,,,,,,,,,,Adult Day Care Center,,,,210 N GROVE St,,,MERRITT ISLAND,Brevard,,FL,,32953,,28.359527,-80.701962,Merritt Park Place,True
HIALEAH SENIOR CLUB INC,,,,,,,2380-90 PALM AVE,,HIALEAH,,,,,Miami-Dade,33010,FL,,(305) 885-5115,,,,,,,,,,,,,,,,,Adult Day Care Center,,,,2380-90 PALM AVE,,,HIALEAH,Miami-Dade,,FL,,33010,,25.843482,-80.282439,,False
HOLISTIC ADULT CARE CENTER INC,,,,,,,10240 SW 56TH ST STE 113 114 115,,MIAMI,,,,,Miami-Dade,33165,FL,,(786) 306-3849,,,,,,,,,,,,,,,,,Adult Day Care Center,,,,10240 SW 56TH ST,STE 113 114 115,,MIAMI,Miami-Dade,,FL,,33165,,25.7152183,-80.35969589999999,,False
HOMESTEAD BEHAVIORAL CLINIC ADULT DAY CARE,,,,,,,654 NE 9TH PLACE,,HOMESTEAD,,,,,Miami-Dade,33030,FL,,(305) 248-3488,,,under construction,,,,,,,,,,,,,,Adult Day Care Center,,,,654 NE 9TH Pl,,,HOMESTEAD,Miami-Dade,,FL,,33030,,25.479288,-80.4677975,,True
HOPE ADULT DAY CARE INC.,,,,,,,1560 ROBERTS DRIVE,,JACKSONVILLE BEACH,,,,,Duval,32250,FL,,(904) 249-4673,,,hopeadcjaxbeach.com,,,,,,,,,,,,,,Adult Day Care Center,,,,8298 BAYBERRY Rd,SUITE 3,,JACKSONVILLE,Duval,,FL,,32256,,30.21802150000001,-81.58244069999999,Southside,True
HOPE CARE CENTER,,,,,,,2668 WINKLER AVENUE,,FORT MYERS,,,,,Lee,33901,FL,,(239) 985-6400,,,hopehcs.org,,,,,,,,,,,,,,Adult Day Care Center,,,,2668 WINKLER Ave,,,FORT MYERS,Lee,,FL,,33901,,26.6038743,-81.8581279,Winkler,True
HOPE CARE CENTER,,,,,,,2668 WINKLER AVENUE,,FORT MYERS,,,,,Lee,33901,FL,,(239) 985-6400,,,www.hopehcs.org,,,,,,,,,,,,,,Adult Day Care Center,,,,3280 TAMIAMI Trl,SUITE 45-47,,PORT CHARLOTTE,Charlotte,,FL,,33952,,26.9839324,-82.0980032,,True
HOPE CARE CENTER,,,,,,,2668 WINKLER AVE,,FORT MYERS,,,,,Lee,33901,FL,,(239) 985-6400,,,www.hopehcs.org,,,,,,,,,,,,,,Adult Day Care Center,,,,1201 WINGS WAY,,,LEHIGH ACRES,Lee,,FL,,33936,,26.5986221,-81.6512412,Alabama,False
HOPE CARE CENTER,,,,,,,2668 WINKLER AVE,,FORT MYERS,,,,,Lee,33901,FL,,(239) 985-6400,,,Hopehcs.org,,,,,,,,,,,,,,Adult Day Care Center,,,,13020 LIVINGSTON RD,,,NAPLES,Collier,,FL,,34105,,26.20905399999999,-81.7503725,Urban Estates,False
HOPE CARE CENTER,,,,,,,2668 WINKLER AVENUE,,FORT MYERS,,,,,Lee,33901,FL,,(239) 985-6400,,,www.hopehcs.org,,,,,,,,,,,,,,Adult Day Care Center,,,,1435 SANTA BARBARA BLVD,,,CAPE CORAL,Lee,,FL,,33991,,26.625111,-81.9731568,Hancock,False
HOPE FAMILY ADULT DAY CARE  INC,,,,,,,204 MCKENZIE UNIT A,,PUNTA GORDA,,,,,Charlotte,33950,FL,,(941) 505-6920,,,www.hopefamilyadultdaycare.com,,,,,,,,,,,,,,Adult Day Care Center,,,,204 MCKENZIE,UNIT A,,PUNTA GORDA,Charlotte,,FL,,33950,,26.92755909999999,-82.04537289999999,,False
I F A ADULT CARE  INC,,,,,,,14008 SW 8TH ST,,MIAMI,,,,,Miami-Dade,33184,FL,,,,,,,,,,,,,,,,,,,Adult Day Care Center,,,,14008 SW 8TH ST,,,MIAMI,Miami-Dade,,FL,,33184,,25.7604608,-80.42092020000001,,False
I MATTER ADULT DAY CENTER LLC,,,,,,,3427 W WOOLBRIGHT RD,,BOYNTON BEACH,,,,,Palm Beach,33436,FL,,(561) 777-7492,,,,,,,,,,,,,,,,,Adult Day Care Center,,,,3427 W WOOLBRIGHT RD,,,BOYNTON BEACH,Palm Beach,,FL,,33436,,26.5133811,-80.1024253,Quail Ridge,False
IDEAL ADULT DAYCARE CENTER  INC.,,,,,,,5972 WEST 16TH AVENUE,,HIALEAH,,,,,Miami-Dade,33012,FL,,(305) 827-3122,,,,,,,,,,,,,,,,,Adult Day Care Center,,,,5972 WEST 16TH Ave,,,HIALEAH,Miami-Dade,,FL,,33012,,25.8767368,-80.3155675,,True
IDEAL STAY ADULT DAY CARE AND REHAB CENTER INC,,,,,,,2164 JOG RD,,GREENACRES,,,,,Palm Beach,33415,FL,,(561) 557-4591,,,www.idealstayadultdaycare.com,,,,,,,,,,,,,,Adult Day Care Center,,,,2164 JOG RD,,,GREENACRES,Palm Beach,,FL,,33415,,26.64759949999999,-80.14538449999999,,False
IRV WEISSMAN ADULT DAY CENTER AT MENORAH MANOR,,,,,,,255 59TH STREET NORTH,,SAINT PETERSBURG,,,,,Pinellas,33710,FL,,(727) 345-2775,,,www.menorahmanor.org,,,,,,,,,,,,,,Adult Day Care Center,,,,255 59TH St N,,,SAINT PETERSBURG,Pinellas,,FL,,33710,,27.7735606,-82.7136422,,True
J & C ADULT DAY CARE INC,,,,,,,18505 NW 75TH PL STE 114,,MIAMI,,,,,Miami-Dade,33015,FL,,(305) 202-3676,,,,,,,,,,,,,,,,,Adult Day Care Center,,,,18505 NW 75TH PL,STE 114,,MIAMI,Miami-Dade,,FL,,33015,,25.9409127,-80.32159089999999,,False
JAIME'S ADULT DAY CENTERS LLC,,,,,,,13510 SHADY SHORES DR,,TAMPA,,,,,Hillsborough,33613,FL,,(813) 263-6735,,,,,,,,,,,,,,,,,Adult Day Care Center,,,,18950 N DALE MABRY HWY,,,LUTZ,Hillsborough,,FL,,33548,,28.1526848,-82.4918963,,False
JERRI'S PLACE  LLC,,,,,,,PO BOX 90154,,LAKELAND,,,,,Polk,33804-0154,FL,,(863) 687-6401,,,www.jerrisadultcare.com,,,,,,,,,,,,,,Adult Day Care Center,,,,624 W 5TH ST,,,LAKELAND,Polk,,FL,,33805,,28.0585738,-81.96334449999999,Paul A Digg,False
JESUS ES MI ROCA INC,,,,,,,10900 SW 184 STREET,,MIAMI,,,,,Miami-Dade,33157,FL,,(305) 278-8264,,,,,,,,,,,,,,,,,Adult Day Care Center,,,,10900 SW 184 St,,,MIAMI,Miami-Dade,,FL,,33157,,25.5972179,-80.368548,,True
JOY OF LIFE ADULT DAY CARE INC (THE),,,,,,,15190 SW 136TH STREET  STE 6,,MIAMI,,,,,Miami-Dade,33196,FL,,(786) 293-3310,,,www.joylifecenter.com,,,,,,,,,,,,,,Adult Day Care Center,,,,15190 SW 136TH St,STE 6,,MIAMI,Miami-Dade,,FL,,33196,,25.6398432,-80.4385959,,True
JUDY'S PLACE,,,,,,,604 WALNUT ST,,GREEN COVE SPRINGS,,,,,Clay,32043,FL,,(904) 531-5020,,,,,,,,,,,,,,,,,Adult Day Care Center,,,,1701 PARK AVE,,,ORANGE PARK,Clay,,FL,,32073,,30.1688932,-81.69825519999999,,False
KANE CENTER,,,,,,,900 SE SALERNO RD,,STUART,,,,,Martin,34997,FL,,(772) 223-7843,,,www.kanecenter.org,,,,,,,,,,,,,,Adult Day Care Center,,,,900 SE SALERNO RD,,,STUART,Martin,,FL,,34997,,27.1275235,-80.2419757,,False
KEY TRAINING CENTER,,,,,,,5399 W GULF TO LAKE HWY,,LECANTO,,,,,Citrus,34461-8531,FL,,(352) 795-5541,,,www.keytrainingcenter.org,,,,,,,,,,,,,,Adult Day Care Center,,,,1311 N GARNETT MILLER LOOP,,,LECANTO,Citrus,,FL,,34461,,28.81230800000001,-82.51787999999999,,False
KURT & ALICE WALTER ADULT DAY CARE & ALZHEIMER'S PAVILION,,,,,,,5000 NOB HILL ROAD,,SUNRISE,,,,,Broward,33351,FL,,(954) 742-2299,,,cantorcenter.com,,,,,,,,,,,,,,Adult Day Care Center,,,,5000 NOB HILL Rd,,,SUNRISE,Broward,,FL,,33351,,26.1868096,-80.2831119,,True
L.E.A.D. SERVICES,,,,,,,14533 FENNEY CR,,JACKSONVILLE,,,,,Duval,32258,FL,,(904) 503-2244,,,,,,,,,,,,,,,,,Adult Day Care Center,,,,1068 ARLINGTON RD N,,,JACKSONVILLE,Duval,,FL,,32211,,30.33081419999999,-81.5885065,Arlington,True
LA DOLCE VITA ADULT DAY CARE INC,,,,,,,6457 SW 13TH ST,,WEST MIAMI,,,,,Miami-Dade,33144,FL,,(305) 300-3356,,,,,,,,,,,,,,,,,Adult Day Care Center,,,,1030 E 8TH AVE,,,HIALEAH,Miami-Dade,,FL,,33010,,25.8321281,-80.2658677,,False
LA EDAD DE ORO ADULT DAY CARE  LLC,,,,,,,5870 SW 8TH ST,STE 8,WEST MIAMI,,,,,Miami-Dade,33144-5052,FL,,(305) 262-2700,,,miedaddeoro.com,,,,,,,,,,,,,,Adult Day Care Center,,,,5870 SW 8TH ST,,,WEST MIAMI,Miami-Dade,,FL,,33144-5052,,25.76315649999999,-80.2910835,,False
LA MERCED ADULT DAY CARE CORP,,,,,,,8707 SW 9TH TERRACE ST. STE. 14,,MIAMI,,,,,Miami-Dade,33174,FL,,(786) 837-1639,,,,,,,,,,,,,,,,,Adult Day Care Center,,,,8707 SW 9TH TERRACE ST,STE 14,,MIAMI,Miami-Dade,,FL,,33174,,25.7609648,-80.3368266,,False
LAKE COUNTY ADULT ACTIVITY CENTER INC,,,,,,,355 CITRUS TOWER BLVD. SUITE 102,,CLERMONT,,,,,Lake,34711,FL,,(352) 404-6098,,,,,,,,,,,,,,,,,Adult Day Care Center,,,,355 CITRUS TOWER BLVD,SUITE 102,,CLERMONT,Lake,,FL,,34711,,28.5644285,-81.7373458,,False
LAKE COUNTY ADULT ACTIVITY CENTER  INC.,,,,,,,248 MOHAWK RD,,CLERMONT,,,,,Lake,34715-7433,FL,,(352) 404-6098,,,,,,,,,,,,,,,,,Adult Day Care Center,,,,1934 N DONNELLY ST,STE B,,MOUNT DORA,Lake,,FL,,32757,,28.813957,-81.644459,,False
LAKELAND MULTI-PURPOSE SENIOR CENTER,,,,,,,PO BOX 9005,,BARTOW,,,,,Polk,33831-9005,FL,,(863) 499-2606,,,,,,,,,,,,,,,,,Adult Day Care Center,,,,1200 SOUTHERN Ave,,,LAKELAND,Polk,,FL,,33815,,28.027809,-81.985404,,True
LARGO ADULT DAY CARE CENTER,,,,,,,11095 131ST STREET,,LARGO,,,,,Pinellas,33774,FL,,(727) 593-1253,,,neighborly.org,,,,,,,,,,,,,,Adult Day Care Center,,,,11095 131ST St,,,LARGO,Pinellas,,FL,,33774,,27.8738432,-82.8190784,,True
LAS MERCEDES ADULT DAY CARE I  INC,,,,,,,50 LINDSAY CT 101,,HIALEAH,,,,,Miami-Dade,33010,FL,,(786) 900-0090,,,,,,,,,,,,,,,,,Adult Day Care Center,,,,1619 NW 27TH AVE,,,MIAMI,Miami-Dade,,FL,,33125,,25.7889351,-80.23948659999999,Little Havana,False
LAS MERCEDES ADULT DAY CARE II INC,,,,,,,2750 W 68TH STREET SUITE 125-126,,HIALEAH,,,,,Miami-Dade,33016,FL,,(305) 400-9985,,,,,,,,,,,,,,,,,Adult Day Care Center,,,,2750 W 68 ST,STE 125-128,,HIALEAH,Miami-Dade,,FL,,33016,,25.882784,-80.3383333,,False
LAS MERCEDES ADULT DAY CARE III  INC,,,,,,,50 LINDSAY CT 101,,HIALEAH,,,,,Miami-Dade,33010,FL,,(305) 400-9985,,,,,,,,,,,,,,,,,Adult Day Care Center,,,,9839-9841 SW 40TH ST,,,MIAMI,Miami-Dade,,FL,,33165,,25.732696,-80.3547516,,False
LAS MIAS ADULT DAY CARE,,,,,,,6429 SW 8TH STREET,,MIAMI,,,,,Miami-Dade,33144,FL,,(305) 262-0850,,,,,,,,,,,,,,,,,Adult Day Care Center,,,,6429 SW 8TH St,,,MIAMI,Miami-Dade,,FL,,33144,,25.7635415,-80.3005991,Flagami,True
LAUDERDALE LAKES ALZHEIMER CARE CENTER,,,,,,,4320 NORTH WEST 36TH STREET,,LAUDERDALE LAKES,,,,,Broward,33319,FL,,(954) 535-2800,,,www.lauderdalelakes.org,,,,,,,,,,,,,,Adult Day Care Center,,,,4320 NORTH WEST 36TH St,,,LAUDERDALE LAKES,Broward,,FL,,33319,,26.1705825,-80.2068633,,True
LCC ADULT DAY CARE  LLC,,,,,,,551 EAST 49TH STREET #12-13,,HIALEAH,,,,,Miami-Dade,33013,FL,,(305) 687-3800,,,lccadultdaycare.com,,,,,,,,,,,,,,Adult Day Care Center,,,,551 EAST 49TH St,# 12-13,,HIALEAH,Miami-Dade,,FL,,33013,,25.8676006,-80.27159809999999,,True
LIBERTAD ADULT DAY CARE CORP,,,,,,,925 SW 122ND AVE,,MIAMI,,,,,Miami-Dade,33184,FL,,(786) 536-9124,,,,,,,,,,,,,,,,,Adult Day Care Center,,,,925 SW 122ND AVE,,,MIAMI,Miami-Dade,,FL,,33184,,25.7595676,-80.3923275,,False
LIFE ADULT DAY CARE LLC,,,,,,,932 SW 82 AVE,,MIAMI,,,,,Miami-Dade,33144,FL,,(305) 456-0407,,,,,,,,,,,,,,,,,Adult Day Care Center,,,,932 SW 82 AVE,,,MIAMI,Miami-Dade,,FL,,33144,,25.7606396,-80.3279258,,False
LITTLE HAVANA ACTIVITIES & NUTRITION CENTERS OF DADE COUNTY  INC,,,,,,,700 SW 8TH STREET,,MIAMI,,,,,Miami-Dade,33130,FL,,(305) 858-0887,,,,,,,,,,,,,,,,,Adult Day Care Center,,,,700 SW 8TH St,,,MIAMI,Miami-Dade,,FL,,33130,,25.7656544,-80.2059799,Little Havana,True
LITTLE HAVANA ACTIVITIES & NUTRITION CENTERS OF DADE COUNTY  INC,,,,,,,700 SW 8TH ST,,MIAMI,,,,,Miami-Dade,33130,FL,,,,,,,,,,,,,,,,,,,Adult Day Care Center,,,,8551 HAMMOCKS BLVD,,,MIAMI,Miami-Dade,,FL,,33193,,25.6867312,-80.43621949999999,,False
LITTLE HAVANA ACTIVITIES AND NUTRITION CENTER OF DADE COUNTY INC,,,,,,,700 SW 8TH STREET,,MIAMI,,,,,Miami-Dade,33130,FL,,(305) 558-2570,,,www.LHANC.org,,,,,,,,,,,,,,Adult Day Care Center,,,,4410 WEST 16TH St,# 28C,,HIALEAH,Miami-Dade,,FL,,33012,,25.8614534,-80.3158335,,True
LIVING LIFE ADULT DAY CARE CORP,,,,,,,10720 NW 66TH ST APT 308,,DORAL,,,,,,33178,FL,,(305) 463-0391,,,www.livinglifeadc.com,,,,,,,,,,,,,,Adult Day Care Center,,,,1835 NW 112TH AVE,,,MIAMI,Miami-Dade,,FL,,33172,,25.7916877,-80.37609890000002,,False
LONG LIFE ADULT DAYCARE INC,,,,,,,5995 SW 8TH ST,,MIAMI,,,,,Miami-Dade,33144,FL,,(786) 384-9482,,,,,,,,,,,,,,,,,Adult Day Care Center,,,,5995 SW 8TH ST,,,MIAMI,Miami-Dade,,FL,,33144,,25.76356669999999,-80.29304379999999,Flagami,False
LOU'S PLACE A CARE COTTAGE,,,,,,,1150 W MINNEOLA AVE,,CLERMONT,,,,,Lake,34711,FL,,(352) 708-5544,,,,,,,,,,,,,,,,,Adult Day Care Center,,,,1150 W MINNEOLA AVE,,,CLERMONT,Lake,,FL,,34711,,28.5566148,-81.77476109999999,,False
LOVING HEART ADULT DAY CARE INC,,,,,,,5711 INDEPENDENCE CIR STE 2,,FORT MYERS,,,,,Lee,33912,FL,,(239) 437-2788,,,www.lovingheartadc.com,,,,,,,,,,,,,,Adult Day Care Center,,,,5711 INDEPENDENCE CIR,STE 2,,FORT MYERS,Lee,,FL,,33912,,26.530095,-81.85827549999999,,False
LOVING HEART ADULT DAY CARE INC,,,,,,,422 NE 2ND PL STE 100,,CAPE CORAL,,,,,,33909,FL,,(239) 437-2788,,,,,,,,,,,,,,,,,Adult Day Care Center,,,,422 NE 2ND PL,STE 100,,CAPE CORAL,Lee,,FL,,33909,,26.658701,-81.96791,Mariner,False
MAGIK ADULT DAYCARE CENTER LLC,,,,,,,4830 NW 167TH STREET,,MIAMI,,,,,Miami-Dade,33014,FL,,(239) 321-1002,,,,,,,,,,,,,,,,,Adult Day Care Center,,,,4830 NW 167TH St,,,MIAMI,Miami-Dade,,FL,,33014,,25.9246805,-80.2794819,,True
MAGNOLIA MANOR SENIOR DAY PROGRAM  LLC,,,,,,,141 BARKS DRIVE,,FORT WALTON BEACH,,,,,Okaloosa,32547,FL,,(850) 362-6556,,,magnoliamanor.biz,,,,,,,,,,,,,,Adult Day Care Center,,,,141 BARKS Dr,,,FORT WALTON BEACH,Okaloosa,,FL,,32547,,30.4534399,-86.6369144,,True
MARIA'S ADULT DAY CARE CENTER LLC,,,,,,,7821 SEMINOLE BLVD,,SEMINOLE,,,,,Pinellas,33772,FL,,(727) 223-3999,,,,,,,,,,,,,,,,,Adult Day Care Center,,,,26224 US HIGHWAY 19 N,,,CLEARWATER,Pinellas,,FL,,33761,,28.0058897,-82.73040259999999,,True
MARIAS ADULT DAY CARE CENTER LLC,,,,,,,7821 SEMINOLE BLVD,,SEMINOLE,,,,,Pinellas,33772,FL,,(727) 393-7711,,,www.mariacares.com,,,,,,,,,,,,,,Adult Day Care Center,,,,7821 SEMINOLE BLVD,,,SEMINOLE,Pinellas,,FL,,33772,,27.8434834,-82.78674439999999,,False
MARTHA'S ADULT DAYCARE & SERVICES  INC,,,,,,,5918 COPPER LAKE DR,,JACKSONVILLE,,,,,Duval,32218,FL,,(904) 766-0496,,,,,,,,,,,,,,,,,Adult Day Care Center,,,,8668 LEM TURNER RD,,,JACKSONVILLE,Duval,,FL,,32208,,30.3990957,-81.6837,Northside,False
MEALS ON WHEELS PLUS ADULT DAY CENTER,,,,,,,811 23RD AVE E,,BRADENTON,,,,,Manatee,34208,FL,,(941) 748-3001,,,www.mealsonwheelsplus.org,,,,,,,,,,,,,,Adult Day Care Center,,,,10920 E STATE RD,70,,LAKEWOOD RANCH,Manatee,,FL,,34202-8400,,27.4320428,-82.4335215,,False
MELISSA'S PLACE INC.,,,,,,,711 CLEVELAND AVE,,WILDWOOD,,,,,Sumter,34785,FL,,(352) 399-6862,,,www.melissasplaceadcc.net,,,,,,,,,,,,,,Adult Day Care Center,,,,711 CLEVELAND AVE,,,WILDWOOD,Sumter,,FL,,34785,,28.8658763,-82.0327267,,False
MEMORIAL ADULT DAY CARE CENTER,,,,,,,1750 EAST HALLANDALE BEACH BLVD.,,HALLANDALE BEACH,,,,,Broward,33009,FL,,(954) 457-0505,,,www.mhs.net,,,,,,,,,,,,,,Adult Day Care Center,,,,1750 EAST HALLANDALE BEACH BLVD,,,HALLANDALE BEACH,Broward,,FL,,33009,,25.9847409,-80.1308065,,False
MEMORY & WELLNESS CENTER AT FLORIDA ATLANTIC UNIVERSITY,,,,,,,777 GLADES ROAD,BUILDING AZ-79,BOCA RATON,,,,,Palm Beach,33431,FL,,(561) 297-0503,,,www.fau.edu/memorywellnesscenter,,,,,,,,,,,,,,Adult Day Care Center,,,,777 GLADES Rd,,,BOCA RATON,Palm Beach,,FL,,33431,,26.3655442,-80.10234779999999,,True
MI SEGUNDA CASA ADULT DAY CARE INC.,,,,,,,3599 NW 7TH STREET,,MIAMI,,,,,Miami-Dade,33125,FL,,(786) 426-0084,,,,,,,,,,,,,,,,,Adult Day Care Center,,,,3599 NW 7TH ST,,,MIAMI,Miami-Dade,,FL,,33125,,25.779251,-80.253801,Little Havana,False
MIAMI BEACH DAY CARE FOR FRAIL ELDERLY,,,,,,,610 ESPANOLA WAY,,MIAMI BEACH,,,,,Miami-Dade,33139,FL,,(305) 673-6060,,,www.jcsfl.org,,,,,,,,,,,,,,Adult Day Care Center,,,,610 ESPANOLA WAY,,,MIAMI BEACH,Miami-Dade,,FL,,33139,,25.7867153,-80.1346626,Flamingo / Lummus,False
MIAMI HORIZON CORP,,,,,,,10000 SW 56TH STREET,STE. 33-36,MIAMI,,,,,Miami-Dade,33165,FL,,(786) 534-8080,,,miamihorizon.org,,,,,,,,,,,,,,Adult Day Care Center,,,,10000 SW 56TH St,STE 33-36,,MIAMI,Miami-Dade,,FL,,33165,,25.7152529,-80.3573735,,True
MIAMI-DADE COUNTY HOMESTEAD ADULT DAY CARE CENTER (THE),,,,,,,111 NW 1ST ST,# 2550,HOMESTEAD,,,,,Miami-Dade,33030,FL,,(305) 242-7676,,,www.miamidade.gov/cahsd,,,,,,,,,,,,,,Adult Day Care Center,,,,653 SW 4TH St,,,HOMESTEAD,Miami-Dade,,FL,,33030,,25.4664111,-80.4865129,,True
MIAMI-DADE COUNTY SOUTH DADE ADULT DAY CARE CENTER (THE),,,,,,,19590 OLD CUTLER ROAD,,MIAMI,,,,,Miami-Dade,33157,FL,,(305) 255-1433,,,www.miamidade.gov/cahsd,,,,,,,,,,,,,,Adult Day Care Center,,,,19590 OLD CUTLER Rd,,,MIAMI,Miami-Dade,,FL,,33157,,25.5604612,-80.3609874,,True
MILLENNIUM HOUSE OF SOUTHWEST FLORIDA,,,,,,,8951 BONITA BEACH ROAD  SUITE 297,,BONITA SPRINGS,,,,,Lee,34135,FL,,(239) 992-5513,,,,,,,,,,,,,,,,,Adult Day Care Center,,,,8951 BONITA BEACH Rd,,,BONITA SPRINGS,Lee,,FL,,34135,,26.32855069999999,-81.8039136,,True
MIMAS ADULT DAY CARE CENTER INC,,,,,,,7300 W 20 AVE,,HIALEAH,,,,,Miami-Dade,33016,FL,,(305) 244-4133,,,,,,,,,,,,,,,,,Adult Day Care Center,,,,7300 W 20 AVE,,,HIALEAH,Miami-Dade,,FL,,33016,,25.88911,-80.32494799999999,,False
MIS ABUELITOS FELICES ADULT DAY CARE  INC,,,,,,,15260 SW 280TH ST  BAY 118-119,,HOMESTEAD,,,,,Miami-Dade,33032,FL,,(305) 245-0553,,,,,,,,,,,,,,,,,Adult Day Care Center,,,,15260 SW 280TH ST,BAY 118-119,,HOMESTEAD,Miami-Dade,,FL,,33032,,25.5060158,-80.4381892,,False
MISSION OAKS ADULT DAY CARE,,,,,,,10780 N US HWY 301,,OXFORD,,,,,Sumter,34484,FL,,(352) 330-3900,,,,,,,,,,,,,,,,,Adult Day Care Center,,,,10780 N US HWY 301,,,OXFORD,Sumter,,FL,,34484,,28.9132244,-82.0381793,,True
MORNING STAR ADULT DAY CARE CENTER CORP.,,,,,,,2741- 45 S.W. 142 AVE,,MIAMI,,,,,Miami-Dade,33175,FL,,(305) 485-4002,,,,,,,,,,,,,,,,,Adult Day Care Center,,,,2741- 45 SW 142 AVE,,,MIAMI,Miami-Dade,,FL,,33175,,25.7419272,-80.42352819999999,,False
MORNING STAR ADULT DAY CARE CENTER II CORP,,,,,,,13208 SW 8TH ST,,MIAMI,,,,,Miami-Dade,33184,FL,,(305) 905-5208,,,,,,,,,,,,,,,,,Adult Day Care Center,,,,13206-08 SW 8TH ST,,,MIAMI,Miami-Dade,,FL,,33184,,25.7604892,-80.41012549999999,,False
MORSELIFE ADULT DAY CARE CENTER,,,,,,,2475 W ATLANTIC AVE,,DELRAY BEACH,,,,,Palm Beach,33445,FL,,(561) 687-5790,,,,,,,,,,,,,,,,,Adult Day Care Center,,,,2475 W ATLANTIC AVE,,,DELRAY BEACH,Palm Beach,,FL,,33445,,26.4591691,-80.0991025,,False
MOUNT OLYMPUS SENIOR CARE AND ACTIVITY CENTER CORP,,,,,,,14443 COUNTRY WALK DR.,,MIAMI,,,,,Miami-Dade,33186,FL,,(786) 230-6621,,,www.mtoseniorcenter.com,,,,,,,,,,,,,,Adult Day Care Center,,,,14443 COUNTRY WALK DR,,,MIAMI,Miami-Dade,,FL,,33186,,25.630138,-80.427177,,False
