name,contact_first_name,contact_last_name,contact_name,email,contact_email,fax,mailing_address_line_1,mailing_address_line_2,mailing_city,mailing_contact_first_name,mailing_contact_last_name,mailing_contact_name,mailing_country,mailing_county,mailing_postalcode,mailing_province,provider_name,primary_phone,secondary_phone,twitter,website,source,contact_occupation,dsgne_first_name,dsgne_last_name,admin_name,co_address_line_1,co_address_line_2,co_company,co_city,co_postalcode,co_province,ombudsman_phone,typeofcare,typeofcare2,low_high_rate,low_rate,high_rate,address_line_1,address_line_2,address_directions,city,municipality,region,province,state_id,postal_code,country,latitude,longitude,neighborhood,addr_valid
A & D LOVE AND CARE  INC,,,,,,,5931 NW 173RD DR UNIT 3,,HIALEAH,,,,,Miami-Dade,33015-5107,FL,,(305) 510-5745,,,,,,,,,,,,,,,,,Adult Day Care Center,,,,5931 NW 173RD DR,UNIT 3,,HIALEAH,Miami-Dade,,FL,,33015-5107,,25.9311445,-80.2989498,,False
A BETTER LIFE ADULT DAY CARE  INC,,,,,,,8313 W HILLSBOROUGH AVE BLDG 400,,TAMPA,,,,,Hillsborough,33615,FL,,(813) 892-4214,,,,,,,,,,,,,,,,,Adult Day Care Center,,,,8313 W HILLSBOROUGH AVE,BLDG 400,,TAMPA,Hillsborough,,FL,,33615,,27.998136,-82.57631599999999,Town N Country Alliance,False
A JOYFUL HEART SENIOR SERVICES,,,,,,,12201 PEMBROKE RD,,PEMBROKE PINES,,,,,Broward,33025,FL,,,,,,,,,,,,,,,,,,,Adult Day Care Center,,,,12201 PEMBROKE RD,,,PEMBROKE PINES,Broward,,FL,,33025,,25.99543989999999,-80.3086312,,False
A MI MANERA ADULT DAY CARE,,,,,,,7397 SW 8TH ST,,MIAMI,,,,,Miami-Dade,33144,FL,,(305) 588-0570,,,,,,,,,,,,,,,,,Adult Day Care Center,,,,7397 SW 8TH ST,,,MIAMI,Miami-Dade,,FL,,33144,,25.7629636,-80.3154156,Flagami,False
A PLACE FOR YOU ADULT DAY CARE AND REHAB CENTER CORP,,,,,,,4996 10TH AVE N HAVERHILL RD STE 5,,GREENACRES,,,,,Palm Beach,33463,FL,,(561) 965-6980,,,www.aplaceforyouadultdaycare.com,,,,,,,,,,,,,,Adult Day Care Center,,,,4996 10TH RD N HAVERHILL,STE 5,,GREENACRES,Palm Beach,,FL,,33463,,26.6302409,-80.12008569999999,,False
ABC ADULT DAY CARE LLC,,,,,,,11150 SW 211TH ST  NO 100,,CUTLER BAY,,,,,Miami-Dade,33189,FL,,(786) 478-6860,,,,,,,,,,,,,,,,,Adult Day Care Center,,,,11150 SW 211TH St,NO 100,,CUTLER BAY,Miami-Dade,,FL,,33189,,25.5706113,-80.3708489,,True
ABC-ALSY ADULT DAY CARE CENTERS LLC,,,,,,,248 NW 9TH AVE,,HOMESTEAD,,,,,Miami-Dade,33030,FL,,(305) 242-5333,,,,,,,,,,,,,,,,,Adult Day Care Center,,,,248 NW 9TH AVE,,,HOMESTEAD,Miami-Dade,,FL,,33030,,25.4725457,-80.48884749999999,,False
ABIS 'ADULT DAY CARE INC,,,,,,,10910 W FLAGLER ST STE 109-110,,MIAMI,,,,,Miami-Dade,33174,FL,,(305) 225-2550,,,,,,,,,,,,,,,,,Adult Day Care Center,,,,10910 W FLAGLER ST,STE 109-110,,MIAMI,Miami-Dade,,FL,,33174,,25.7677496,-80.37411259999999,,False
ABUELO'S DAY CARE CORP,,,,,,,15435 SW 137TH AVE,,MIAMI,,,,,Miami-Dade,33177-1279,FL,,(305) 232-6230,,,,,,,,,,,,,,,,,Adult Day Care Center,,,,15435 SW 137TH AVE,,,MIAMI,Miami-Dade,,FL,,33177-1279,,25.6239904,-80.41320549999999,,False
ABUELOS ADULT CARE  LLC,,,,,,,3383 NW 7TH ST 101,,MIAMI,,,,,Miami-Dade,33125,FL,,(786) 486-9878,,,,,,,,,,,,,,,,,Adult Day Care Center,,,,3383 NW 7TH ST,101,,MIAMI,Miami-Dade,,FL,,33125,,25.7794074,-80.250664,Little Havana,False
ABUELOS ADULT DAY CARE,,,,,,,3314 W COLUMBUS DR STE B,,TAMPA,,,,,Hillsborough,33607,FL,,(813) 748-8363,,,,,,,,,,,,,,,,,Adult Day Care Center,,,,3314 W COLUMBUS DR,STE B,,TAMPA,Hillsborough,,FL,,33607,,27.96631829999999,-82.4982065,Northwest Tampa,False
ACTIVE ADULT CARE LLC,,,,,,,909 BRYAN RD,,BRANDON,,,,,Hillsborough,33511,FL,,(813) 571-1227,,,,,,,,,,,,,,,,,Adult Day Care Center,,,,909 BRYAN RD,,,BRANDON,Hillsborough,,FL,,33511,,27.9239693,-82.2771984,,False
ACTIVE ADULT DAY CARE CENTER  LLC,,,,,,,1470 NW 36TH STREET,,MIAMI,,,,,Miami-Dade,33142,FL,,(305) 635-9933,,,,,,,,,,,,,,,,,Adult Day Care Center,,,,1470 NW 36TH St,,,MIAMI,Miami-Dade,,FL,,33142,,25.8093753,-80.2212061,Allapattah,True
ACTS ADULT CARE CENTER LLC,,,,,,,8765 SW 165TH AVE  STE 103-104,,MIAMI,,,,,Miami-Dade,33193,FL,,(786) 409-2317,,,,,,,,,,,,,,,,,Adult Day Care Center,,,,8765 SW 165TH AVE,STE 103-104,,MIAMI,Miami-Dade,,FL,,33193,,25.6852237,-80.4597184,,False
ADD TO LIFE ADULT DAY CARE CENTER INC,,,,,,,5877 OLD TIMUQUANA RD,,JACKSONVILLE,,,,,Duval,32210,FL,,(904) 779-1777,,,addtolifeadultdaycare.net,,,,,,,,,,,,,,Adult Day Care Center,,,,5877 OLD TIMUQUANA RD,,,JACKSONVILLE,Duval,,FL,,32210,,30.247628,-81.73598700000001,Westside,False
ADOLPH & ROSE LEVIS ALZHEIMER AND ADULT DAY CARE CENTER,,,,,,,1515 WEST PALMETTO PARK RD,,BOCA RATON,,,,,Palm Beach,33486,FL,,(561) 477-4907,,,www.volencenter.com,,,,,,,,,,,,,,Adult Day Care Center,,,,21050 95TH Ave S,,,BOCA RATON,Palm Beach,,FL,,33428,,26.3608804,-80.1924128,,True
ADULT ACTIVITY CENTER OF THE TREASURE COAST  INC,,,,,,,579 NW LAKE WHITNEY PL STE 104,,PORT SAINT LUCIE,,,,,St. Lucie,34986,FL,,(772) 237-4500,,,,,,,,,,,,,,,,,Adult Day Care Center,,,,579 NW LAKE WHITNEY PL,STE 104,,PORT SAINT LUCIE,St. Lucie,,FL,,34986,,27.316693,-80.4031105,Saint Lucie West,False
ADULT DAY CARE CENTER OF ALTAMONTE SPRINGS INC,,,,,,,1329 E ALTAMONTE DR,,ALTAMONTE SPRINGS,,,,,Seminole,32701,FL,,(407) 636-6321,,,Adcas.biz,,,,,,,,,,,,,,Adult Day Care Center,,,,1329 E ALTAMONTE DR,,,ALTAMONTE SPRINGS,Seminole,,FL,,32701,,28.6634414,-81.34783209999999,,False
ADULT DAY CARE CENTERS CORP,,,,,,,19110 SW 177TH AVE UNIT C,,MIAMI,,,,,Miami-Dade,33187-2004,FL,,(305) 233-2222,,,,,,,,,,,,,,,,,Adult Day Care Center,,,,19110 SW 177TH AVE,UNIT C,,MIAMI,Miami-Dade,,FL,,33187-2004,,25.5884271,-80.47845439999999,,False
ADULT DAY CARE WELLNESS & OUTREACH CENTER INC,,,,,,,815 N HOMESTEAD BLVD #258,,HOMESTEAD,,,,,Miami-Dade,33030,FL,,(305) 224-8086,,,,,,,,,,,,,,,,,Adult Day Care Center,,,,17 NE 1ST RD,UNIT B,,HOMESTEAD,Miami-Dade,,FL,,33030,,25.469621,-80.474633,,False
ADULT DAY CENTER OF SOUTH FLORIDA INC,,,,,,,8221 SW 192ND ST,,CUTLER BAY,,,,,Miami-Dade,33157,FL,,(786) 732-4055,,,,,,,,,,,,,,,,,Adult Day Care Center,,,,9855 SW 184TH ST,,,PALMETTO BAY,Miami-Dade,,FL,,33157,,25.598989,-80.3513361,,False
ADULT DAY OF AVENTURA CORP,,,,,,,3575 NE 207TH ST STE B-6-A,,AVENTURA,,,,,Miami-Dade,33180,FL,,(646) 568-0701,,,,,,,,,,,,,,,,,Adult Day Care Center,,,,3575 NE 207TH ST,STE B-6-A,,AVENTURA,Miami-Dade,,FL,,33180,,25.96878,-80.130371,,False
ADULT HOPE DAY CARE INC,,,,,,,12039 SW 132ND CT UNIT 12 & 13,,MIAMI,,,,,Miami-Dade,33186,FL,,(786) 266-0173,,,,,,,,,,,,,,,,,Adult Day Care Center,,,,12039 SW 132ND CT,UNIT 12 & 13,,MIAMI,Miami-Dade,,FL,,33186,,25.7538009,-80.410878,,False
ADVANCE CARE COMMUNITY CENTER,,,,,,,114 DEL PRADO BLVD S # 200,,CAPE CORAL,,,,,Lee,33990-1724,FL,,(239) 400-4196,,,http://www.advancecarehha.com,,,,,,,,,,,,,,Adult Day Care Center,,,,1490 NE PINE ISLAND RD,BLDG 4 E & F,,CAPE CORAL,Lee,,FL,,33909,,26.654171,-81.965715,Hancock,False
AL'Z PLACE,,,,,,,1610 NW 23 AVENUE,,GAINESVILLE,,,,,Alachua,32605,FL,,(352) 375-3000,,,,,,,,,,,,,,,,,Adult Day Care Center,,,,1610 NW 23 Ave,,,GAINESVILLE,Alachua,,FL,,32605,,29.6743901,-82.34244369999999,,True
ALBYEL'S ADULT DAY CARE,,,,,,,8040 NW 95 ST STE 335,,HIALEAH GARDENS,,,,,Miami-Dade,33016,FL,,(786) 302-4345,,,,,,,,,,,,,,,,,Adult Day Care Center,,,,8040 NW 95 ST,STE 335,,HIALEAH GARDENS,Miami-Dade,,FL,,33016,,25.8592436,-80.3277428,,False
ALEGRIA ADULT DAYCARE INC,,,,,,,345-355 WEST 78 ROAD,,HIALEAH,,,,,Miami-Dade,33014,FL,,(305) 364-1115,,,,,,,,,,,,,,,,,Adult Day Care Center,,,,345-355 WEST 78 Rd,,,HIALEAH,Miami-Dade,,FL,,33014,,25.8942695,-80.2907178,,True
ALL ONE FAMILY SENIOR DAY PROGRAM  INC,,,,,,,585 N COURTENAY PKWY,STE 101,MERRITT IS,,,,,Brevard,32953-4853,FL,,(321) 453-6577,,,all1family4seniors,,,,,,,,,,,,,,Adult Day Care Center,,,,585 N COURTENAY PKWY,,,MERRITT IS,Brevard,,FL,,32953-4853,,28.366133,-80.7015586,,False
ALL SAINTS EARLY LEARNING & COMMUNITY CARE CENTER INC,,,,,,,4171 HENDRICKS AVENUE,,JACKSONVILLE,,,,,Duval,32207,FL,,(904) 737-7800,,,,,,,,,,,,,,,,,Adult Day Care Center,,,,4171 HENDRICKS Ave,,,JACKSONVILLE,Duval,,FL,,32207,,30.2779703,-81.64934509999999,Southside,True
ALL SMILES ADULT DAY CARE CENTER LLC,,,,,,,417 S TAMIAMI TRL,,VENICE,,,,,Sarasota,34285,FL,,(941) 882-3059,,,,,,,,,,,,,,,,,Adult Day Care Center,,,,417 S TAMIAMI TRL,,,VENICE,Sarasota,,FL,,34285,,27.093255,-82.443866,,False
ALMOST HOME DAYBREAK,,,,,,,3604 CARDINAL POINT DRIVE,,JACKSONVILLE,,,,,Duval,32257,FL,,(904) 731-4002,,,almosthomeseniorservices.com,,,,,,,,,,,,,,Adult Day Care Center,,,,3604 CARDINAL POINT Dr,,,JACKSONVILLE,Duval,,FL,,32257,,30.2068049,-81.6185261,Southside,True
ALWAYS AT YOUR SIDE ADULT DAY CARE INC,,,,,,,13965-67 NW 67TH AVE,,MIAMI LAKES,,,,,Miami-Dade,33014,FL,,(305) 467-7353,,,,,,,,,,,,,,,,,Adult Day Care Center,,,,13965-67 NW 67TH AVE,,,MIAMI LAKES,Miami-Dade,,FL,,33014,,25.9008528,-80.30772499999999,,False
ALZHEIMER'S COMMUNITY CARE INC,,,,,,,800 NORTHPOINT PKWY,NO 101B,WEST PALM BEACH,,,,,,33407,FL,,(561) 585-7781,,,www.alzcare.org,,,,,,,,,,,,,,Adult Day Care Center,,,,1615 LAKE Ave,,,LAKE WORTH,Palm Beach,,FL,,33460,,26.6152947,-80.0645594,,True
ALZHEIMER'S COMMUNITY CARE INC,,,,,,,800 NORTHPOINT PARKWAY,SUITE 101-B,WEST PALM BEACH,,,,,Palm Beach,34407,FL,,(561) 683-2700,,,,,,,,,,,,,,,,,Adult Day Care Center,,,,2200 NORTH FEDERAL Hwy,,,STUART,Martin,,FL,,34994,,27.2323751,-80.2686351,,True
ALZHEIMER'S COMMUNITY CARE INC,,,,,,,800 NORTHPOINT PARKWAY,SUITE 101-B,WEST PALM BEACH,,,,,Palm Beach,33407,FL,,(561) 683-2700,,,www.alzcare.org,,,,,,,,,,,,,,Adult Day Care Center,,,,4075 HOLLY DR,,,PALM BCH GDNS,Palm Beach,,FL,,33410-5501,,26.8238979,-80.0990377,,False
ALZHEIMER'S COMMUNITY CARE INC,,,,,,,2900 SOUTH JENKINS RD,,FORT PIERCE,,,,,St. Lucie,34981,FL,,(561) 683-2700,,,alcare.org,,,,,,,,,,,,,,Adult Day Care Center,,,,2900 SOUTH JENKINS RD,,,FORT PIERCE,St. Lucie,,FL,,34981,,27.4114344,-80.3820222,,False
ALZHEIMER'S COMMUNITY CARE INC,,,,,,,800 NORTHPOINT PKWY #101-B,,WEST PALM BEACH,,,,,Palm Beach,33407,FL,,(561) 683-2700,,,www.alzcare.org,,,,,,,,,,,,,,Adult Day Care Center,,,,2703 NORTH SEACREST BLVD,,,DELRAY BEACH,Palm Beach,,FL,,33444,,26.5552304,-80.067172,,False
ALZHEIMER'S COMMUNITY CARE INC,,,,,,,800 NORTHPOINT PKWY STE 101 B,,WEST PALM BEACH,,,,,Palm Beach,33407,FL,,(561) 683-2700,,,www.alzcare.org,,,,,,,,,,,,,,Adult Day Care Center,,,,1925 BIRKDALE DR,,,WELLINGTON,Palm Beach,,FL,,33414,,26.652505,-80.222959,,False
ALZHEIMER'S COMMUNITY CARE  INC,,,,,,,800 NORTHPOINT PKWY  SUITE 101-A,,WEST PALM BEACH,,,,,Palm Beach,33407,FL,,(561) 683-2700,,,www.alzcare.org,,,,,,,,,,,,,,Adult Day Care Center,,,,800 NORTHPOINT PKWY,SUITE 101-A,,WEST PALM BEACH,Palm Beach,,FL,,33407,,26.7627215,-80.0956011,,False
ALZHEIMER'S COMMUNITY CARE  INC,,,,,,,800 NORTHPOINT PKWY STE 101B,,WEST PALM BCH,,,,,Palm Beach,33407-1978,FL,,(561) 383-2700,,,www.alzcare.org,,,,,,,,,,,,,,Adult Day Care Center,,,,470 EAST FIRST St,,,PAHOKEE,Palm Beach,,FL,,33476,,26.8236637,-80.6614737,,True
ALZHEIMERS COMMUNITY CARE INC,,,,,,,800 NORTHPOINT PKWY  101-B,,WEST PALM BEACH,,,,,Palm Beach,33407,FL,,(561) 683-2700,,,,,,,,,,,,,,,,,Adult Day Care Center,,,,295 NW PRIMA VISTA BLVD,,,PORT SAINT LUCIE,St. Lucie,,FL,,34983,,27.31834049999999,-80.3542962,,False
ALZHEIMERS COMMUNITY CARE  INC,,,,,,,800 NORTHPOINT PKWY  101-B,,WEST PALM BEACH,,,,,Palm Beach,33407,FL,,(561) 683-2700,,,www.alzcare.org,,,,,,,,,,,,,,Adult Day Care Center,,,,4680 N DIXIE HWY,,,BOCA RATON,Palm Beach,,FL,,33431,,26.39125370000001,-80.0804958,,False
ALZHEIMERS COMMUNITY CARE  INC,,,,,,,800 NORTHPOINT PWY  101-B,,WEST PALM BEACH,,,,,Palm Beach,33407,FL,,(561) 683-2700,,,www.alzcare.org,,,,,,,,,,,,,,Adult Day Care Center,,,,3680 LAKE WORTH RD,,,LAKE WORTH,Palm Beach,,FL,,33461,,26.6172553,-80.10038449999999,,False
AMANECER ADULT DAY CARE CENTER  INC,,,,,,,14550 SW 8TH ST,,MIAMI,,,,,Miami-Dade,33184,FL,,(786) 362-5770,,,www.amaneceradultdaycare.com,,,,,,,,,,,,,,Adult Day Care Center,,,,14550 SW 8TH ST,,,MIAMI,Miami-Dade,,FL,,33184,,25.7606052,-80.4487161,,False
AMAZING AGE- ADULT DAY STAY,,,,,,,7306 A W ATLANTIC BLVD,,MARGATE,,,,,Broward,33063,FL,,(954) 970-9185,,,www.amazing-age.com,,,,,,,,,,,,,,Adult Day Care Center,,,,7306 A W ATLANTIC BLVD,,,MARGATE,Broward,,FL,,33063,,26.23407479999999,-80.2239992,,False
AMERICAN PROVIDERS ADULT DAY CARE CENTER  LLC,,,,,,,2000 NW 89TH PLACE,,DORAL,,,,,Miami-Dade,33172,FL,,(305) 591-9975,,,,,,,,,,,,,,,,,Adult Day Care Center,,,,2000 NW 89TH Pl,,,DORAL,Miami-Dade,,FL,,33172,,25.7922675,-80.34322519999999,,True
ANGEL'S UNIQUE LLC,,,,,,,13520 17TH AVENUE,,DADE CITY,,,,,Pasco,33525,FL,,(352) 523-1111,,,antiqueangels.com,,,,,,,,,,,,,,Adult Day Care Center,,,,13520 17TH Ave,,,DADE CITY,Pasco,,FL,,33525,,28.3544628,-82.1996564,,True
ANGELS ADULT DAY CARE INC,,,,,,,2350 W 84TH STREET,SUITE 19,HIALEAH,,,,,Miami-Dade,33016,FL,,(786) 343-7772,,,,,,,,,,,,,,,,,Adult Day Care Center,,,,2350 W 84TH St,,,HIALEAH,Miami-Dade,,FL,,33016,,25.8969888,-80.33119429999999,,True
AÑOS DORADO ADULT DAY CARE,,,,,,,9815 SW 40TH ST,,MIAMI,,,,,Miami-Dade,33165-3911,FL,,(786) 797-5603,,,,,,,,,,,,,,,,,Adult Day Care Center,,,,9815 SW 40TH ST,,,MIAMI,Miami-Dade,,FL,,33165-3911,,25.73272,-80.35442979999999,,False
ANOS DORADOS ADULT DAY CARE ACTIVITY AND RECREATION CENTER INC,,,,,,,7751 W 28TH AVE  UNIT 11,,HIALEAH,,,,,Miami-Dade,33016,FL,,(305) 608-5167,,,,,,,,,,,,,,,,,Adult Day Care Center,,,,7751 W 28TH AVE,UNIT 11,,HIALEAH,Miami-Dade,,FL,,33016,,25.8928107,-80.3395267,,False
ANY SWEET HOME ADULT DAY CARE CORP,,,,,,,14285 SW 42ND ST STE 202,,MIAMI,,,,,Miami-Dade,33175,FL,,(786) 314-2760,,,,,,,,,,,,,,,,,Adult Day Care Center,,,,14285 SW 42ND ST,STE 202,,MIAMI,Miami-Dade,,FL,,33175,,25.730186,-80.42509009999999,,False
AZUCAR ADULT DAY CARE  LLC,,,,,,,8655-C SW 24TH ST,,MIAMI,,,,,Miami-Dade,33155,FL,,(305) 815-8367,,,www.azucarcare.net,,,,,,,,,,,,,,Adult Day Care Center,,,,8655-C SW 24TH ST,,,MIAMI,Miami-Dade,,FL,,33155,,25.7486245,-80.3350837,,False
BANYAN HEALTH SYSTEMS INC,,,,,,,6100 BLUE LAGOON DRIVE,SUITE 400,MIAMI,,,,,Miami-Dade,33126,FL,,(305) 406-9585,,,,,,,,,,,,,,,,,Adult Day Care Center,,,,1905 NW 82ND Ave,,,DORAL,Miami-Dade,,FL,,33122,,25.7915266,-80.32840139999999,,True
BAY BREEZE SENIOR LIVING AND REHABILITATION CENTER,,,,,,,3387 GULF BREEZE PKWY,,GULF BREEZE,,,,,Santa Rosa,32563-3351,FL,,(850) 932-9257,,,,,,,,,,,,,,,,,Adult Day Care Center,,,,3387 GULF BREEZE PKWY,,,GULF BREEZE,Santa Rosa,,FL,,32563-3351,,30.3859234,-87.08246419999999,,False
BEACH CLUB ADULT CENTER LLC,,,,,,,2500 E HALLANDALE BEACH BLVD STE T,,HALLANDALE BEACH,,,,,Broward,33009,FL,,(754) 210-6943,,,,,,,,,,,,,,,,,Adult Day Care Center,,,,2500 E HALLANDALE BEACH BLVD,STE T,,HALLANDALE BEACH,Broward,,FL,,33009,,25.9856157,-80.1252784,,False
BLESSED TRINITY ELDER CARE CENTER,,,,,,,5 SE 17TH STREET  BLDG L,,OCALA,,,,,Marion,34471,FL,,(352) 671-2823,,,blessedtrinity.org/elder-care,,,,,,,,,,,,,,Adult Day Care Center,,,,44 SW 15TH Pl,,,OCALA,Marion,,FL,,34471,,29.1732147,-82.136967,,True
BLOOMINGDALE ADULT DAY CARE CENTER,,,,,,,PO BOX 1110,601 E KENNEDY BLVD 16TH FLOOR,TAMPA,,,,,Hillsborough,33602,FL,,(813) 276-8358,,,,,,,,,,,,,,,,,Adult Day Care Center,,,,3940 CANOGA PARK Dr,,,BRANDON,Hillsborough,,FL,,33511,,27.882208,-82.2733891,,True
BLUE STAR ADULT DAY CARE CENTER INC,,,,,,,1380 N KROME AVE STE 103 & 104,,FLORIDA CITY,,,,,Miami-Dade,33034,FL,,(786) 554-3613,,,,,,,,,,,,,,,,,Adult Day Care Center,,,,1380 N KROME AVE,STE 103 & 104,,FLORIDA CITY,Miami-Dade,,FL,,33034,,25.4835058,-80.4778722,,False
BRANDON SENIOR CENTER,,,,,,,601 E KENNEDY BLVD,FL 16,TAMPA,,,,,Hillsborough,33602-4932,FL,,(813) 635-8066,,,www.hillsboroughcounty.org/aging,,,,,,,,,,,,,,Adult Day Care Center,,,,612 NORTH PARSONS Ave,,,BRANDON,Hillsborough,,FL,,33510,,27.9485865,-82.28665289999999,Limona Improvement,True
BREVARD ALZHEIMER'S FOUNDATION INC,,,,,,,4676 NORTH WICKHAM ROAD,,MELBOURNE,,,,,Brevard,32935,FL,,(321) 253-4430,,,www.brevardalz.org,,,,,,,,,,,,,,Adult Day Care Center,,,,4676 NORTH WICKHAM Rd,,,MELBOURNE,Brevard,,FL,,32935,,28.1850944,-80.672749,,True
BREVARD ALZHEIMER'S FOUNDATION INC,,,,,,,4676 NORTH WICKHAM ROAD,,MELBOURNE,,,,,Brevard,32935,FL,,(772) 664-9996,,,www.brevardalz.org,,,,,,,,,,,,,,Adult Day Care Center,,,,7951 RON BEATTY BLVD,,,MICCO,Brevard,,FL,,32976,,27.881553,-80.505533,,False
BREVARD ALZHEIMER'S FOUNDATION INC,,,,,,,830 SOUTH PARK AVENUE,,TITUSVILLE,,,,,Brevard,32780,FL,,(321) 268-9144,,,www.brevardalz.org,,,,,,,,,,,,,,Adult Day Care Center,,,,830 SOUTH PARK Ave,,,TITUSVILLE,Brevard,,FL,,32780,,28.6073332,-80.8186001,,True
BROWARD ADULT DAY CARE CENTER CORP,,,,,,,4788 NW 1ST ST,,PLANTATION,,,,,Broward,33317-3136,FL,,(305) 798-4535,,,,,,,,,,,,,,,,,Adult Day Care Center,,,,2615 DAVIE BLVD,,,FT LAUDERDALE,Broward,,FL,,33312-3029,,26.1069241,-80.17637049999999,South Fort Lauderdale,False
CADC CORP.,,,,,,,7944 SW 8TH STREET,,MIAMI,,,,,Miami-Dade,33144,FL,,(305) 269-6845,,,,,,,,,,,,,,,,,Adult Day Care Center,,,,7944 SW 8TH St,,,MIAMI,Miami-Dade,,FL,,33144,,25.7617025,-80.3252134,,True
CAMPO DE ESTRELLAS ADULT DAY CARE  INC.,,,,,,,10208 NW 80TH AVENUE,,HIALEAH GARDENS,,,,,Miami-Dade,33016,FL,,(786) 222-8123,,,,,,,,,,,,,,,,,Adult Day Care Center,,,,10208 NW 80TH Ave,,,HIALEAH GARDENS,Miami-Dade,,FL,,33016,,25.8670351,-80.327131,,True
CARE ANGELS ADULT CENTER INC,,,,,,,2500 SW 107TH AVE STE 27,,MIAMI,,,,,Miami-Dade,33165,FL,,(305) 553-4545,,,,,,,,,,,,,,,,,Adult Day Care Center,,,,2500 SW 107TH AVE,STE 27,,MIAMI,Miami-Dade,,FL,,33165,,25.7458285,-80.3683915,,False
CARES,,,,,,,13906 FIFTH STREET,,DADE CITY,,,,,Pasco,33525,FL,,(727) 862-9291,,,www.caresfl.org,,,,,,,,,,,,,,Adult Day Care Center,,,,13906 FIFTH St,,,DADE CITY,Pasco,,FL,,33525,,28.3601488,-82.18721939999999,Crescent Park,True
CARES,,,,,,,6640 VAN BUREN STREET,,PORT RICHEY,,,,,Pasco,34653,FL,,(727) 862-9291,,,www.caresfl.org,,,,,,,,,,,,,,Adult Day Care Center,,,,6640 VAN BUREN ST,,,NEW PORT RICHEY,Pasco,,FL,,34652,,28.2546911,-82.7113924,Golden Heights,False
CARITAS ALEGRES ADULT DAY CARE INC,,,,,,,2401-2407 NW 7TH ST,,MIAMI,,,,,Miami-Dade,33125,FL,,(786) 523-5382,,,,,,,,,,,,,,,,,Adult Day Care Center,,,,2401-2407 NW 7TH ST,,,MIAMI,Miami-Dade,,FL,,33125,,25.7798189,-80.2356969,Little Havana,False
CASA DEL SOL ADULT DAY CARE LLC,,,,,,,14740 SW 26TH ST  STE 102 & 103,,MIAMI,,,,,Miami-Dade,33185,FL,,(305) 310-6552,,,,,,,,,,,,,,,,,Adult Day Care Center,,,,14740 SW 26TH ST,STE 102& 103,,MIAMI,Miami-Dade,,FL,,33185,,25.7421512,-80.4338807,,False
CATHOLIC CHARITIES OF THE ARCHDIOCESE OF MIAMI INC,,,,,,,1503 NE 26TH STREET,,WILTON MANORS,,,,,Broward,33305,FL,,(954) 630-9501,,,www.ccadm.org,,,,,,,,,,,,,,Adult Day Care Center,,,,1503 NE 26TH St,,,WILTON MANORS,Broward,,FL,,33305,,26.1602333,-80.1264494,,True
CATHOLIC CHARITIES OF THE ARCHDIOCESE OF MIAMI  INC.,,,,,,,6915 STIRLING ROAD,,DAVIE,,,,,Broward,33314,FL,,(954) 583-6446,,,ccadm.org,,,,,,,,,,,,,,Adult Day Care Center,,,,6915 STIRLING Rd,,,DAVIE,Broward,,FL,,33314,,26.0459223,-80.23691699999999,,True
CELEBRATION ADULT DAY CARE INC,,,,,,,10739 W FLAGLER ST,,MIAMI,,,,,Miami-Dade,33174,FL,,(305) 631-2616,,,,,,,,,,,,,,,,,Adult Day Care Center,,,,10739 W FLAGLER ST,,,MIAMI,Miami-Dade,,FL,,33174,,25.7685367,-80.3706272,,False
CENTRO AXIS,,,,,,,P.O. BOX 940156,,MIAMI,,,,,Miami-Dade,33194,FL,,(305) 668-0634,,,www.centroaxis.com,,,,,,,,,,,,,,Adult Day Care Center,,,,6840 SW 40TH St,,,MIAMI,Miami-Dade,,FL,,33155,,25.7326464,-80.3047619,,True
CHANGE OF PACE  INC.,,,,,,,4514 HAMMOCK ROAD,,SEBRING,,,,,Highlands,33872,FL,,(863) 382-1188,,,www.highlandsadultdaycare.com,,,,,,,,,,,,,,Adult Day Care Center,,,,4514 HAMMOCK Rd,,,SEBRING,Highlands,,FL,,33872,,27.4714175,-81.51043899999999,,True
CHELSEA PLACE ADULT DAY CARE LLC,,,,,,,3626 TAMIAMI TRL,,PORT CHARLOTTE,,,,,Charlotte,33980,FL,,(941) 676-3411,,,,,,,,,,,,,,,,,Adult Day Care Center,,,,3626 TAMIAMI TRL,,,PORT CHARLOTTE,Charlotte,,FL,,33980,,26.9774909,-82.0910942,,False
CHOICES IN LIVING  LLC,,,,,,,3812 SKYLINE BLVD,SUITES C AND D,CAPE CORAL,,,,,Lee,33914,FL,,(239) 540-6813,,,www.ciladultdaycare.com,,,,,,,,,,,,,,Adult Day Care Center,,,,3812 SKYLINE BLVD,,,CAPE CORAL,Lee,,FL,,33914,,26.5809325,-81.9912749,Pelican,False
CITY OF MIRAMAR ADULT DAY CARE CENTER,,,,,,,2300 CIVIC CENTER PL,,MIRAMAR,,,,,Broward,33025,FL,,(954) 883-5220,,,,,,,,,,,,,,,,,Adult Day Care Center,,,,8915 MIRAMAR PKWY,,,MIRAMAR,Broward,,FL,,33025,,25.981505,-80.2654529,,False
CLAY COUNTY COUNCIL ON AGING  INC.,,,,,,,604 WALNUT STREET,,GREEN COVE SPRINGS,,,,,Clay,32043,FL,,(904) 284-3134,,,www.clayccoa.org,,,,,,,,,,,,,,Adult Day Care Center,,,,604 WALNUT St,,,GREEN COVE SPRINGS,Clay,,FL,,32043,,29.9931562,-81.6816661,,True
COCONUT GROVE ADULT DAY CARE CENTER  INC,,,,,,,2440 SW 27TH A VE,,MIAMI,,,,,Miami-Dade,33145,FL,,(786) 308-7260,,,,,,,,,,,,,,,,,Adult Day Care Center,,,,2440 SW 27TH AVE,,,MIAMI,Miami-Dade,,FL,,33145,,25.7457361,-80.2383882,Coral Way,False
COPACABANA ADULT DAY CARE CENTER  CORP,,,,,,,3800 WEST 12 AVENUE  SUITE 2,,HIALEAH,,,,,Miami-Dade,33012,FL,,(786) 433-0910,,,,,,,,,,,,,,,,,Adult Day Care Center,,,,3800 WEST 12 Ave,SUITE 2,,HIALEAH,Miami-Dade,,FL,,33012,,25.856512,-80.3076748,,True
CORAL WEST ADULT DAY CARE INC,,,,,,,2370 SW 67 AVENUE  BLDG B,,MIAMI,,,,,Miami-Dade,33155,FL,,(305) 722-4532,,,www.miamiadultdaycare.com,,,,,,,,,,,,,,Adult Day Care Center,,,,2370 SW 67 AVENUE BLDG B,,,MIAMI,Miami-Dade,,FL,,33155,,25.7483905,-80.30378189999999,,False
COUNCIL ON AGING OF ST. LUCIE  INC.,,,,,,,2501 SW BAYSHORE BLVD.,,PORT SAINT LUCIE,,,,,St. Lucie,34984,FL,,(772) 336-8608,,,,,,,,,,,,,,,,,Adult Day Care Center,,,,2501 SW BAYSHORE BLVD,,,PORT SAINT LUCIE,St. Lucie,,FL,,34984,,27.2662308,-80.35072579999999,,False
COUNCIL ON AGING OF WEST FLORIDA  INC,,,,,,,PO BOX 17066,,PENSACOLA,,,,,Escambia,32522,FL,,(850) 432-1475,,,www.coawfla.org,,,,,,,,,,,,,,Adult Day Care Center,,,,875 ROYCE ST,,,PENSACOLA,Escambia,,FL,,32503,,30.46814629999999,-87.2147579,Southeast Pensacola,False
COUNTRY COTTAGE ON MAIN STREET ADULT DAY CARE CENTER LLC,,,,,,,201 S MAIN ST,,BROOKSVILLE,,,,,Hernando,34601,FL,,(727) 459-1189,,,,,,,,,,,,,,,,,Adult Day Care Center,,,,201 S MAIN ST,,,BROOKSVILLE,Hernando,,FL,,34601,,28.5527868,-82.3876508,,False
CRESCENT ADULT DAY CARE INC,,,,,,,1550 W 84TH ST #65,,HIALEAH,,,,,Miami-Dade,33014,FL,,(305) 817-1643,,,,,,,,,,,,,,,,,Adult Day Care Center,,,,1550 W 84TH ST,# 65,,HIALEAH,Miami-Dade,,FL,,33014,,25.8968727,-80.3151256,,False
CRM OF FLORIDA INC,,,,,,,182-B BARTON BLVD,,ROCKLEDGE,,,,,Brevard,32955,FL,,(321) 877-1211,,,,,,,,,,,,,,,,,Adult Day Care Center,,,,182 BARTON BLVD -B,,,ROCKLEDGE,Brevard,,FL,,32955,,28.3311654,-80.7257923,,False
CRYSTAL PARADISE ADULT DAY CARE INC,,,,,,,6355 SW 8TH ST W TOWER 2W 3W 4W 5W,,MIAMI,,,,,Miami-Dade,33144,FL,,(305) 261-0030,,,,,,,,,,,,,,,,,Adult Day Care Center,,,,6355 SW 8TH ST,W TOWER 2W 3W 4W 5W,,MIAMI,Miami-Dade,,FL,,33144,,25.7654353,-80.2196728,East Little Havana,False
DAVID I. SIEGEL ADULT DAY CARE CENTER,,,,,,,1000 BELLE TERRE BLVD.,,PALM COAST,,,,,Flagler,32164,FL,,(386) 437-7300,,,www.flaglercounty.ort,,,,,,,,,,,,,,Adult Day Care Center,,,,1000 BELLE TERRE BLVD,,,PALM COAST,Flagler,,FL,,32164,,29.470487,-81.22184,,False
DAYCATIONS ADULT DAY CARE,,,,,,,2250 STATE ROAD 580,STE 10,CLEARWATER,,,,,Pinellas,33763-1135,FL,,(727) 648-2401,,,Daycationsadultdaycare.com,,,,,,,,,,,,,,Adult Day Care Center,,,,2250 STATE Rd,580,,CLEARWATER,Pinellas,,FL,,33763-1135,,28.0199599,-82.7444646,,True
DAYSCAPE ADULT CARE CENTER  INC.,,,,,,,4800 WEST HILLSBORO BLVD,SUITE 12,COCONUT CREEK,,,,,Broward,33073,FL,,(954) 531-1771,,,www.dayscape.net,,,,,,,,,,,,,,Adult Day Care Center,,,,4800 WEST HILLSBORO BLVD,,,COCONUT CREEK,Broward,,FL,,33073,,26.3165422,-80.1890935,,False
DBS BABY BOOMERS ADULT DAY  HEALTH & ENRICHMENT CENTER,,,,,,,14734 SW 56ST,,MIAMI,,,,,Miami-Dade,33185,FL,,(786) 360-1258,,,,,,,,,,,,,,,,,Adult Day Care Center,,,,14734 SW 56ST,,,MIAMI,Miami-Dade,,FL,,33185,,25.7135188,-80.4318408,,False
DEL CASTILLO ADULT DAY CARE INC,,,,,,,3536 W FLAGER ST,,MIAMI,,,,,Miami-Dade,33135,FL,,(786) 531-0848,,,,,,,,,,,,,,,,,Adult Day Care Center,,,,3536 W FLAGER ST,,,MIAMI,Miami-Dade,,FL,,33135,,25.7717235,-80.2531522,Little Havana,False
DIAMAR ADULT DAYCARE CENTER CORP,,,,,,,10989 SW 186TH ST,,MIAMI,,,,,Miami-Dade,33157,FL,,(305) 256-9944,,,,,,,,,,,,,,,,,Adult Day Care Center,,,,10989 SW 186TH ST,,,MIAMI,Miami-Dade,,FL,,33157,,25.5957692,-80.36957760000001,,False
DOUBLE NINE SENIORS CLUB II INC,,,,,,,4670 W 4TH AVE,,HIALEAH,,,,,Miami-Dade,33012,FL,,(305) 825-4459,,,,,,,,,,,,,,,,,Adult Day Care Center,,,,4670 W 4TH AVE,,,HIALEAH,Miami-Dade,,FL,,33012,,25.8644499,-80.2910644,,False
DOUBLE NINE SENIORS CLUB  INC.,,,,,,,4719 PALM AVENUE,,HIALEAH,,,,,Miami-Dade,33012,FL,,(305) 825-4459,,,,,,,,,,,,,,,,,Adult Day Care Center,,,,4719 PALM Ave,,,HIALEAH,Miami-Dade,,FL,,33012,,25.865344,-80.2826879,,True
EASTER SEALS FLORIDA INC,,,,,,,2010 MIZELL AVENUE,,WINTER PARK,,,,,Orange,32792,FL,,(407) 629-4565,,,,,,,,,,,,,,,,,Adult Day Care Center,,,,2010 MIZELL Ave,,,WINTER PARK,Orange,,FL,,32792,,28.5950758,-81.325257,,True
EASTER SEALS FLORIDA  INC.,,,,,,,520 N. SEMORAN BLVD.  SUITE 280,,ORLANDO,,,,,Orange,32807,FL,,(352) 377-7708,,,www.easterseals.com/florida,,,,,,,,,,,,,,Adult Day Care Center,,,,2002 NW 36TH Ave,,,GAINESVILLE,Alachua,,FL,,32605,,29.6861419,-82.34986649999999,Ridgeview,True
EASTER SEALS SOUTH FLORIDA  INC,,,,,,,1475 NW  14 AVENUE,,MIAMI,,,,,Miami-Dade,33125,FL,,(305) 325-0470,,,http://www.easterseals.com/southflorida/,,,,,,,,,,,,,,Adult Day Care Center,,,,1475 NW 14 Ave,,,MIAMI,Miami-Dade,,FL,,33125,,25.78887589999999,-80.21808039999999,Allapattah,True
EASTER SEALS THERAPEUTIC DAY CARE-HIALEAH,,,,,,,1475 NW 14TH AVENUE,,MIAMI,,,,,Miami-Dade,33125,FL,,(305) 887-7370,,,www.southflorida.easterseals.com,,,,,,,,,,,,,,Adult Day Care Center,,,,489 HIALEAH Dr,UNITS 7 8 9,,HIALEAH,Miami-Dade,,FL,,33010,,25.8236716,-80.2718293,,True
EL JARDIN ADULT DAY CARE LLC,,,,,,,4195 SW 137TH AVE STE 5,,MIAMI,,,,,Miami-Dade,33175,FL,,(305) 456-0122,,,,,,,,,,,,,,,,,Adult Day Care Center,,,,4195 SW 137TH AVE,STE 5,,MIAMI,Miami-Dade,,FL,,33175,,25.7298856,-80.4153779,,False
